{
  "$schema": "https://json-schema.org/draft/2020-12/schema",
  "$id": "https://rightmodeler.com/schemas/remediation-lifecycle.schema.json",
  "title": "Remediation Lifecycle Event",
  "type": "object",
  "required": [
    "version",
    "event_id",
    "evidence_id",
    "event_type",
    "actor",
    "timestamp",
    "reason",
    "repository_revision",
    "affected_files",
    "pre_apply_digests",
    "post_apply_digests",
    "validation",
    "restored"
  ],
  "properties": {
    "version": { "type": "string" },
    "event_id": {
      "type": "string",
      "pattern": "^sha256:[a-f0-9]{64}$"
    },
    "evidence_id": {
      "type": "string",
      "pattern": "^sha256:[a-f0-9]{64}$"
    },
    "event_type": {
      "type": "string",
      "enum": [
        "approved",
        "applied",
        "apply_failed",
        "rolled_back",
        "rollback_failed"
      ]
    },
    "actor": { "type": "string", "minLength": 1 },
    "timestamp": { "type": "string", "format": "date-time" },
    "reason": { "type": ["string", "null"] },
    "repository_revision": {
      "type": "string",
      "pattern": "^([a-f0-9]{40}|[a-f0-9]{64})$"
    },
    "affected_files": {
      "type": "array",
      "items": { "type": "string", "minLength": 1 }
    },
    "pre_apply_digests": {
      "type": "object",
      "additionalProperties": {
        "anyOf": [
          { "type": "string", "pattern": "^sha256:[a-f0-9]{64}$" },
          { "type": "null" }
        ]
      }
    },
    "post_apply_digests": {
      "type": "object",
      "additionalProperties": {
        "anyOf": [
          { "type": "string", "pattern": "^sha256:[a-f0-9]{64}$" },
          { "type": "null" }
        ]
      }
    },
    "validation": {
      "type": "object",
      "required": ["status", "command_results"],
      "properties": {
        "status": {
          "type": "string",
          "enum": ["not_run", "passed", "failed", "review"]
        },
        "command_results": {
          "type": "array",
          "items": {
            "type": "object",
            "required": [
              "name",
              "command",
              "exit_code",
              "passed",
              "timed_out",
              "duration_ms"
            ],
            "properties": {
              "name": { "type": "string", "minLength": 1 },
              "command": {
                "type": "array",
                "minItems": 1,
                "items": { "type": "string", "minLength": 1 }
              },
              "exit_code": { "type": ["integer", "null"] },
              "passed": { "type": "boolean" },
              "timed_out": { "type": "boolean" },
              "duration_ms": { "type": "number", "minimum": 0 },
              "stdout_summary": { "type": "string" },
              "stderr_summary": { "type": "string" }
            },
            "additionalProperties": false
          }
        }
      },
      "additionalProperties": false
    },
    "restored": { "type": "boolean" }
  },
  "additionalProperties": false
}
